<?xml version='1.0' encoding='utf-8'?>
<ns0:SMC_Packung xmlns:ns0="http://ccsap.bit.admin.ch/SWISSMEDIC/LIMS_HMIT_KHZ" xmlns:xsi="http://www.w3.org/2001/XMLSchema-instance" xsi:schemaLocation="http://ccsap.bit.admin.ch/SWISSMEDIC/LIMS_HMIT_KHZ https://ogd.swissmedic.ch/hmd/ZL/172/Beschreibungen/OGD-Packungen.xsd"><PACKUNG><ZULASSUNGSNUMMER>10029</ZULASSUNGSNUMMER><SEQUENZNUMMER>2</SEQUENZNUMMER><PACKUNGSCODE>2</PACKUNGSCODE><ZULASSUNGSSTATUS>Z</ZULASSUNGSSTATUS><BEMERKUNG_FREITEXT /><PACKUNGSGROESSE>200</PACKUNGSGROESSE><PACKUNGSEINHEIT>ML</PACKUNGSEINHEIT><WIDERRUF_VERZICHT_DATUM /><BTM_CODE /><ABGABEKATEGORIE>D</ABGABEKATEGORIE><PACKUNGSTYP /></PACKUNG><PACKUNG><ZULASSUNGSNUMMER>10167</ZULASSUNGSNUMMER><SEQUENZNUMMER>1</SEQUENZNUMMER><PACKUNGSCODE>1</PACKUNGSCODE><ZULASSUNGSSTATUS>Z</ZULASSUNGSSTATUS><BEMERKUNG_FREITEXT>Beutel à 1.475g</BEMERKUNG_FREITEXT><PACKUNGSGROESSE>20</PACKUNGSGROESSE><PACKUNGSEINHEIT>BEU</PACKUNGSEINHEIT><WIDERRUF_VERZICHT_DATUM /><BTM_CODE /><ABGABEKATEGORIE>D</ABGABEKATEGORIE><PACKUNGSTYP /></PACKUNG><PACKUNG><ZULASSUNGSNUMMER>10167</ZULASSUNGSNUMMER><SEQUENZNUMMER>1</SEQUENZNUMMER><PACKUNGSCODE>2</PACKUNGSCODE><ZULASSUNGSSTATUS>Z</ZULASSUNGSSTATUS><BEMERKUNG_FREITEXT>Beutel à 1.475g</BEMERKUNG_FREITEXT><PACKUNGSGROESSE>50</PACKUNGSGROESSE><PACKUNGSEINHEIT>BEU</PACKUNGSEINHEIT><WIDERRUF_VERZICHT_DATUM /><BTM_CODE /><ABGABEKATEGORIE>D</ABGABEKATEGORIE><PACKUNGSTYP /></PACKUNG><PACKUNG><ZULASSUNGSNUMMER>10167</ZULASSUNGSNUMMER><SEQUENZNUMMER>1</SEQUENZNUMMER><PACKUNGSCODE>29</PACKUNGSCODE><ZULASSUNGSSTATUS>Z</ZULASSUNGSSTATUS><BEMERKUNG_FREITEXT>Beutel à 2.95g</BEMERKUNG_FREITEXT><PACKUNGSGROESSE>20</PACKUNGSGROESSE><PACKUNGSEINHEIT>BEU</PACKUNGSEINHEIT><WIDERRUF_VERZICHT_DATUM /><BTM_CODE /><ABGABEKATEGORIE>D</ABGABEKATEGORIE><PACKUNGSTYP /></PACKUNG><PACKUNG><ZULASSUNGSNUMMER>10167</ZULASSUNGSNUMMER><SEQUENZNUMMER>1</SEQUENZNUMMER><PACKUNGSCODE>3</PACKUNGSCODE><ZULASSUNGSSTATUS>Z</ZULASSUNGSSTATUS><BEMERKUNG_FREITEXT>Beutel à 1.475g mit 1 Applikationshilfe Emser Kindernasendusche Nasanita</BEMERKUNG_FREITEXT><PACKUNGSGROESSE>20</PACKUNGSGROESSE><PACKUNGSEINHEIT>BEU</PACKUNGSEINHEIT><WIDERRUF_VERZICHT_DATUM /><BTM_CODE /><ABGABEKATEGORIE>D</ABGABEKATEGORIE><PACKUNGSTYP /></PACKUNG><PACKUNG><ZULASSUNGSNUMMER>10167</ZULASSUNGSNUMMER><SEQUENZNUMMER>1</SEQUENZNUMMER><PACKUNGSCODE>30</PACKUNGSCODE><ZULASSUNGSSTATUS>Z</ZULASSUNGSSTATUS><BEMERKUNG_FREITEXT>Beutel à 2.95g</BEMERKUNG_FREITEXT><PACKUNGSGROESSE>50</PACKUNGSGROESSE><PACKUNGSEINHEIT>BEU</PACKUNGSEINHEIT><WIDERRUF_VERZICHT_DATUM /><BTM_CODE /><ABGABEKATEGORIE>D</ABGABEKATEGORIE><PACKUNGSTYP /></PACKUNG><PACKUNG><ZULASSUNGSNUMMER>30514</ZULASSUNGSNUMMER><SEQUENZNUMMER>2</SEQUENZNUMMER><PACKUNGSCODE>25</PACKUNGSCODE><ZULASSUNGSSTATUS>D</ZULASSUNGSSTATUS><BEMERKUNG_FREITEXT /><PACKUNGSGROESSE>5</PACKUNGSGROESSE><PACKUNGSEINHEIT>ML</PACKUNGSEINHEIT><WIDERRUF_VERZICHT_DATUM>2026-07-17</WIDERRUF_VERZICHT_DATUM><BTM_CODE /><ABGABEKATEGORIE>A</ABGABEKATEGORIE><PACKUNGSTYP /></PACKUNG><PACKUNG><ZULASSUNGSNUMMER>32238</ZULASSUNGSNUMMER><SEQUENZNUMMER>1</SEQUENZNUMMER><PACKUNGSCODE>1</PACKUNGSCODE><ZULASSUNGSSTATUS>D</ZULASSUNGSSTATUS><BEMERKUNG_FREITEXT /><PACKUNGSGROESSE>100</PACKUNGSGROESSE><PACKUNGSEINHEIT>G</PACKUNGSEINHEIT><WIDERRUF_VERZICHT_DATUM>2026-07-22</WIDERRUF_VERZICHT_DATUM><BTM_CODE /><ABGABEKATEGORIE>D</ABGABEKATEGORIE><PACKUNGSTYP /></PACKUNG><PACKUNG><ZULASSUNGSNUMMER>90001</ZULASSUNGSNUMMER><SEQUENZNUMMER>1</SEQUENZNUMMER><PACKUNGSCODE>1</PACKUNGSCODE><ZULASSUNGSSTATUS>Z</ZULASSUNGSSTATUS><BEMERKUNG_FREITEXT /><PACKUNGSGROESSE>50</PACKUNGSGROESSE><PACKUNGSEINHEIT>ML</PACKUNGSEINHEIT><WIDERRUF_VERZICHT_DATUM /><BTM_CODE /><ABGABEKATEGORIE>D</ABGABEKATEGORIE><PACKUNGSTYP /></PACKUNG></ns0:SMC_Packung>